{
  "id": "es-marido-01",
  "headword": "marido",
  "article": "el",
  "gender": "masculine",
  "partOfSpeech": "noun",
  "cefr": "A1",
  "region": { "variant": "es-ES", "scope": "paninsular-generic" },
  "register": "neutral",
  "topics": ["family"],
  "senses": [
    {
      "gloss": "husband",
      "example": "Su marido es de Navarra.",
      "exampleGloss": "Her husband is from Navarre."
    }
  ],
  "alternatives": [
    { "kind": "register", "value": "esposo", "gloss": "husband", "reason": "Formal/neutral synonym; more common in LatAm, correct but stiffer in Spain." },
    { "kind": "register", "value": "cónyuge", "gloss": "spouse", "reason": "Legal/administrative; covers husband or wife." },
    { "kind": "different-sense", "value": "pareja", "gloss": "partner", "reason": "Does not imply marriage; the everyday word for a partner." }
  ],
  "status": "pending_review",
  "provenance": { "method": "hand-authored" },
  "notes": "marido is the normal Peninsular spoken word; esposo reads more formal or LatAm.",
  "createdAt": "2026-10-17T15:30:00Z"
}
