{
  "id": "es-andar-01",
  "headword": "andar",
  "partOfSpeech": "verb",
  "cefr": "A1",
  "region": { "variant": "es-ES", "scope": "paninsular-generic" },
  "register": "neutral",
  "topics": ["daily-routine", "city"],
  "senses": [
    {
      "gloss": "to walk",
      "example": "Vamos andando al centro.",
      "exampleGloss": "We are walking to the centre."
    }
  ],
  "alternatives": [
    { "kind": "synonym", "value": "caminar", "gloss": "to walk", "reason": "Shared and neutral; andar is more colloquial Peninsular in this sense." },
    { "kind": "different-sense", "value": "pasear", "gloss": "to stroll", "reason": "Walking for pleasure, not to get somewhere." },
    { "kind": "synonym", "value": "ir a pie", "gloss": "to go on foot", "reason": "Phrase that contrasts with going by car or bus." }
  ],
  "status": "pending_review",
  "provenance": { "method": "hand-authored" },
  "notes": "andar also means how someone is doing (¿cómo andas?); that sense is left for B1.",
  "createdAt": "2026-10-17T15:30:00Z"
}
